{
  "id": "dracula",
  "name": "Dracula",
  "description": "Dark purple developer palette with bright pink, cyan, green, and yellow accents.",
  "tags": ["dark", "developer", "terminal"],
  "themes": [
    {
      "name": "Dracula",
      "base": "dark",
      "primary": "#bd93f9",
      "secondary": "#44475a",
      "text": { "primary": "#f8f8f2" },
      "link": { "color": "#8be9fd" },
      "background": { "default": "#282a36", "surface": "#343746", "muted": "#44475a" },
      "sidebar": {
        "background": "#21222c",
        "color": "#f8f8f2",
        "selectedBackground": "#6272a4",
        "selectedColor": "#ffffff",
        "actionBackground": "#bd93f9"
      },
      "navbar": { "background": "#21222c", "color": "#f8f8f2", "searchHint": "#bd93f9" },
      "terminal": {
        "background": "#21222c",
        "foreground": "#f8f8f2",
        "cursor": "#f8f8f2",
        "ansi": {
          "red": "#ff5555",
          "green": "#50fa7b",
          "yellow": "#f1fa8c",
          "blue": "#bd93f9",
          "magenta": "#ff79c6",
          "cyan": "#8be9fd"
        }
      }
    }
  ]
}
