{
  "id": "catppuccin-inspired",
  "name": "Catppuccin Inspired",
  "description": "Soft VS Code-inspired pastel dark theme with warm surfaces, readable text, and calm terminal colours.",
  "tags": ["dark", "developer", "terminal", "community"],
  "themes": [
    {
      "name": "Catppuccin Inspired",
      "base": "dark",
      "primary": "#89b4fa",
      "secondary": "#313244",
      "text": { "primary": "#cdd6f4" },
      "link": { "color": "#89b4fa" },
      "background": {
        "default": "#1e1e2e",
        "surface": "#242438",
        "muted": "#313244"
      },
      "sidebar": {
        "background": "#181825",
        "color": "#cdd6f4",
        "selectedBackground": "#89b4fa",
        "selectedColor": "#11111b",
        "actionBackground": "#a6e3a1"
      },
      "navbar": {
        "background": "#181825",
        "color": "#cdd6f4",
        "searchHint": "#b4befe"
      },
      "terminal": {
        "background": "#11111b",
        "foreground": "#cdd6f4",
        "cursor": "#f5e0dc",
        "ansi": {
          "black": "#6c7086",
          "red": "#f38ba8",
          "green": "#a6e3a1",
          "yellow": "#f9e2af",
          "blue": "#89b4fa",
          "magenta": "#cba6f7",
          "cyan": "#94e2d5",
          "white": "#cdd6f4",
          "brightBlack": "#9399b2",
          "brightRed": "#eba0ac",
          "brightGreen": "#a6e3a1",
          "brightYellow": "#f9e2af",
          "brightBlue": "#89b4fa",
          "brightMagenta": "#cba6f7",
          "brightCyan": "#94e2d5",
          "brightWhite": "#ffffff"
        }
      }
    }
  ]
}
