{
  "id": "aks-inspired",
  "name": "AKS Inspired",
  "description": "Azure Kubernetes Service inspired purples with clear operational contrast.",
  "tags": ["light", "dark", "cloud", "kubernetes"],
  "themes": [
    {
      "name": "AKS Inspired Light",
      "base": "light",
      "primary": "#7b42bc",
      "secondary": "#f1e8ff",
      "text": { "primary": "#211b2d" },
      "link": { "color": "#5b2a86" },
      "background": { "default": "#fbf8ff", "surface": "#ffffff", "muted": "#f1e8ff" },
      "sidebar": {
        "background": "#2b1747",
        "color": "#f5edff",
        "selectedBackground": "#7b42bc",
        "selectedColor": "#ffffff",
        "actionBackground": "#a66cff"
      },
      "navbar": { "background": "#ffffff", "color": "#2b1747", "searchHint": "#7b42bc" },
      "terminal": {
        "background": "#1c102f",
        "foreground": "#f5edff",
        "cursor": "#a66cff",
        "ansi": {
          "blue": "#9b6de0",
          "magenta": "#a66cff",
          "cyan": "#6bdcff",
          "green": "#7fba00",
          "yellow": "#f2c811",
          "red": "#f7630c"
        }
      }
    },
    {
      "name": "AKS Inspired Dark",
      "base": "dark",
      "primary": "#a66cff",
      "secondary": "#362154",
      "text": { "primary": "#f5edff" },
      "link": { "color": "#c7a7ff" },
      "background": { "default": "#140b22", "surface": "#221339", "muted": "#362154" },
      "sidebar": {
        "background": "#0f071a",
        "color": "#f5edff",
        "selectedBackground": "#7b42bc",
        "selectedColor": "#ffffff",
        "actionBackground": "#a66cff"
      },
      "navbar": { "background": "#0f071a", "color": "#f5edff", "searchHint": "#a66cff" },
      "terminal": {
        "background": "#090411",
        "foreground": "#f5edff",
        "cursor": "#a66cff",
        "ansi": {
          "blue": "#7b42bc",
          "magenta": "#a66cff",
          "cyan": "#6bdcff",
          "green": "#7fba00",
          "yellow": "#f2c811",
          "red": "#ff6b5a"
        }
      }
    }
  ]
}
