{
  "id": "pixelrobots",
  "name": "Pixelrobots",
  "description": "Pixel Robots black and yellow palette using the site accent, #ffea00.",
  "tags": [
    "light",
    "dark",
    "brand",
    "terminal"
  ],
  "themes": [
    {
      "name": "Pixelrobots Light",
      "base": "light",
      "primary": "#ffea00",
      "secondary": "#242321",
      "text": {
        "primary": "#1f1e1c"
      },
      "link": {
        "color": "#6a5f00"
      },
      "background": {
        "default": "#f7f5ea",
        "surface": "#ffffff",
        "muted": "#ece7c3"
      },
      "sidebar": {
        "background": "#242321",
        "color": "#f7f5ea",
        "selectedBackground": "#ffea00",
        "selectedColor": "#242321",
        "actionBackground": "#ffea00"
      },
      "navbar": {
        "background": "#242321",
        "color": "#ffffff",
        "searchHint": "#ffea00"
      },
      "terminal": {
        "background": "#151512",
        "foreground": "#f7f5ea",
        "cursor": "#ffea00",
        "ansi": {
          "black": "#151512",
          "white": "#f7f5ea",
          "yellow": "#ffea00",
          "brightYellow": "#fff45c",
          "red": "#ff5c4d",
          "green": "#6bd66b",
          "blue": "#4ea3ff"
        }
      }
    },
    {
      "name": "Pixelrobots Dark",
      "base": "dark",
      "primary": "#ffea00",
      "secondary": "#2f2e28",
      "text": {
        "primary": "#f7f5ea"
      },
      "link": {
        "color": "#ffea00"
      },
      "background": {
        "default": "#151512",
        "surface": "#242321",
        "muted": "#2f2e28"
      },
      "sidebar": {
        "background": "#1b1a17",
        "color": "#f7f5ea",
        "selectedBackground": "#ffea00",
        "selectedColor": "#151512",
        "actionBackground": "#ffea00"
      },
      "navbar": {
        "background": "#242321",
        "color": "#ffffff",
        "searchHint": "#ffea00"
      },
      "terminal": {
        "background": "#10100e",
        "foreground": "#f7f5ea",
        "cursor": "#ffea00",
        "ansi": {
          "black": "#10100e",
          "white": "#f7f5ea",
          "yellow": "#ffea00",
          "brightYellow": "#fff45c",
          "red": "#ff5c4d",
          "green": "#6bd66b",
          "blue": "#4ea3ff"
        }
      }
    }
  ]
}
