{
  "id": "eks-inspired",
  "name": "EKS Inspired",
  "description": "Amazon EKS inspired slate and orange palette for cloud operations.",
  "tags": [
    "light",
    "dark",
    "cloud",
    "kubernetes"
  ],
  "themes": [
    {
      "name": "EKS Inspired Light",
      "base": "light",
      "primary": "#ff9900",
      "secondary": "#eef1f5",
      "text": {
        "primary": "#161e2d"
      },
      "link": {
        "color": "#146eb4"
      },
      "background": {
        "default": "#f7f8fa",
        "surface": "#ffffff",
        "muted": "#eef1f5"
      },
      "sidebar": {
        "background": "#232f3e",
        "color": "#f2f3f3",
        "selectedBackground": "#ff9900",
        "selectedColor": "#161e2d",
        "actionBackground": "#146eb4"
      },
      "navbar": {
        "background": "#232f3e",
        "color": "#ffffff",
        "searchHint": "#ff9900"
      },
      "terminal": {
        "background": "#111827",
        "foreground": "#f2f3f3",
        "cursor": "#ff9900",
        "ansi": {
          "blue": "#146eb4",
          "cyan": "#00a1c9",
          "green": "#2ea44f",
          "yellow": "#ff9900",
          "brightYellow": "#ffd15c",
          "red": "#d13212"
        }
      }
    },
    {
      "name": "EKS Inspired Dark",
      "base": "dark",
      "primary": "#ff9900",
      "secondary": "#2f3b4b",
      "text": {
        "primary": "#f2f3f3"
      },
      "link": {
        "color": "#7cc7ff"
      },
      "background": {
        "default": "#111827",
        "surface": "#1b2533",
        "muted": "#2f3b4b"
      },
      "sidebar": {
        "background": "#0b111c",
        "color": "#d5dbdb",
        "selectedBackground": "#ff9900",
        "selectedColor": "#111827",
        "actionBackground": "#146eb4"
      },
      "navbar": {
        "background": "#0b111c",
        "color": "#f2f3f3",
        "searchHint": "#ff9900"
      },
      "terminal": {
        "background": "#080d15",
        "foreground": "#f2f3f3",
        "cursor": "#ff9900",
        "ansi": {
          "blue": "#7cc7ff",
          "cyan": "#00a1c9",
          "green": "#2ea44f",
          "yellow": "#ff9900",
          "brightYellow": "#ffd15c",
          "red": "#ff6b5a"
        }
      }
    }
  ]
}
