{
  "id": "monokai",
  "name": "Monokai",
  "description": "High-energy dark editor palette with lime, pink, orange, and violet accents.",
  "tags": [
    "dark",
    "developer",
    "terminal"
  ],
  "themes": [
    {
      "name": "Monokai",
      "base": "dark",
      "primary": "#a6e22e",
      "secondary": "#3e3d32",
      "text": {
        "primary": "#f8f8f2"
      },
      "link": {
        "color": "#66d9ef"
      },
      "background": {
        "default": "#272822",
        "surface": "#34352d",
        "muted": "#3e3d32"
      },
      "sidebar": {
        "background": "#1f201b",
        "color": "#f8f8f2",
        "selectedBackground": "#a6e22e",
        "selectedColor": "#1f201b",
        "actionBackground": "#f92672"
      },
      "navbar": {
        "background": "#1f201b",
        "color": "#f8f8f2",
        "searchHint": "#fd971f"
      },
      "terminal": {
        "background": "#1f201b",
        "foreground": "#f8f8f2",
        "cursor": "#a6e22e",
        "ansi": {
          "red": "#f92672",
          "green": "#a6e22e",
          "yellow": "#e6db74",
          "blue": "#66d9ef",
          "magenta": "#ae81ff",
          "cyan": "#66d9ef"
        }
      }
    }
  ]
}
