{
  "id": "gke-inspired",
  "name": "GKE Inspired",
  "description": "Google Kubernetes Engine inspired blue with restrained Google color accents.",
  "tags": ["light", "dark", "cloud", "kubernetes"],
  "themes": [
    {
      "name": "GKE Inspired Light",
      "base": "light",
      "primary": "#1a73e8",
      "secondary": "#e8f0fe",
      "text": { "primary": "#202124" },
      "link": { "color": "#0b57d0" },
      "background": { "default": "#f8fafd", "surface": "#ffffff", "muted": "#e8f0fe" },
      "sidebar": {
        "background": "#202124",
        "color": "#e8eaed",
        "selectedBackground": "#1a73e8",
        "selectedColor": "#ffffff",
        "actionBackground": "#34a853"
      },
      "navbar": { "background": "#ffffff", "color": "#202124", "searchHint": "#5f6368" },
      "terminal": {
        "background": "#15171a",
        "foreground": "#e8eaed",
        "cursor": "#1a73e8",
        "ansi": {
          "blue": "#1a73e8",
          "red": "#ea4335",
          "yellow": "#fbbc04",
          "green": "#34a853",
          "cyan": "#24c1e0",
          "magenta": "#a142f4"
        }
      }
    },
    {
      "name": "GKE Inspired Dark",
      "base": "dark",
      "primary": "#8ab4f8",
      "secondary": "#283447",
      "text": { "primary": "#e8eaed" },
      "link": { "color": "#8ab4f8" },
      "background": { "default": "#15171a", "surface": "#202124", "muted": "#283447" },
      "sidebar": {
        "background": "#111315",
        "color": "#e8eaed",
        "selectedBackground": "#1a73e8",
        "selectedColor": "#ffffff",
        "actionBackground": "#34a853"
      },
      "navbar": { "background": "#111315", "color": "#e8eaed", "searchHint": "#8ab4f8" },
      "terminal": {
        "background": "#0f1113",
        "foreground": "#e8eaed",
        "cursor": "#8ab4f8",
        "ansi": {
          "blue": "#8ab4f8",
          "red": "#f28b82",
          "yellow": "#fdd663",
          "green": "#81c995",
          "cyan": "#78d9ec",
          "magenta": "#c58af9"
        }
      }
    }
  ]
}
